{
  "$schema": "http://json-schema.org/draft-07/schema#",
  "title": "Skill",
  "type": "object",
  "required": [
    "description",
    "disabled_bot_ids",
    "enabled",
    "files",
    "invocations_7d",
    "name",
    "path",
    "source",
    "updated_at"
  ],
  "properties": {
    "description": {
      "type": "string"
    },
    "disabled_bot_ids": {
      "type": "array",
      "items": {
        "type": "string"
      }
    },
    "draft_from": {
      "anyOf": [
        {
          "$ref": "#/definitions/SkillDraftFrom"
        },
        {
          "type": "null"
        }
      ]
    },
    "enabled": {
      "type": "boolean"
    },
    "files": {
      "type": "array",
      "items": {
        "type": "string"
      }
    },
    "invocations_7d": {
      "$ref": "#/definitions/Invocations7d"
    },
    "last_invoked_at": {
      "default": null,
      "type": [
        "string",
        "null"
      ]
    },
    "name": {
      "type": "string"
    },
    "path": {
      "type": "string"
    },
    "source": {
      "$ref": "#/definitions/SkillSource"
    },
    "updated_at": {
      "type": "string"
    }
  },
  "definitions": {
    "BotInvocation": {
      "type": "object",
      "required": [
        "bot_id",
        "count"
      ],
      "properties": {
        "bot_id": {
          "type": "string"
        },
        "count": {
          "type": "integer",
          "format": "uint64",
          "minimum": 0.0
        }
      }
    },
    "Invocations7d": {
      "type": "object",
      "required": [
        "by_bot",
        "total"
      ],
      "properties": {
        "by_bot": {
          "type": "array",
          "items": {
            "$ref": "#/definitions/BotInvocation"
          }
        },
        "total": {
          "type": "integer",
          "format": "uint64",
          "minimum": 0.0
        }
      }
    },
    "SkillDraftFrom": {
      "type": "object",
      "required": [
        "bot_id",
        "bot_name"
      ],
      "properties": {
        "bot_id": {
          "type": "string"
        },
        "bot_name": {
          "type": "string"
        },
        "project_id": {
          "default": null,
          "type": [
            "string",
            "null"
          ]
        },
        "project_name": {
          "default": null,
          "type": [
            "string",
            "null"
          ]
        }
      }
    },
    "SkillSource": {
      "type": "string",
      "enum": [
        "builtin",
        "user",
        "imported",
        "draft"
      ]
    }
  }
}
