{
  "description": "PRD 模板",
  "disabled_bot_ids": [],
  "enabled": true,
  "files": [
    "template.md"
  ],
  "invocations_7d": {
    "by_bot": [],
    "total": 1
  },
  "last_invoked_at": "2026-10-09T10:19:02.312Z",
  "name": "prd-template",
  "path": "skills/prd-template",
  "source": "builtin",
  "updated_at": "2026-10-09T10:19:02.312Z"
}
